{"exclusions":{"rows":[{"mode":"160000","object_type":"commit","oid":"7a651838d6203f1e9493ceb1c5b14dea29e29bfa","path":".claude"},{"mode":"100644","object_type":"blob","oid":"165ea65e122d37eeb153035b129f05f3c959a155","path":".gitmodules"},{"mode":"160000","object_type":"commit","oid":"d6f6ac7627c135fab32348cd537f3ef694264cb8","path":"PtychoNN"},{"mode":"160000","object_type":"commit","oid":"9fa2b986256501fe119192bff33cf24ef4aa7ae1","path":"notebooks/archive/ePIE_recon_simulation"},{"mode":"160000","object_type":"commit","oid":"56626c85aabf39b5ed8a94430077b4f57e418d33","path":"ptycho/FRC"},{"mode":"160000","object_type":"commit","oid":"2a3127bc4941ab335dd16299e36ded22a9e0a366","path":"scripts/orchestration"}],"serialization":"canonical-json-lf.v1","sha256":"sha256:8f7b02d2fe83700990f133e523e25c7a808c4057c15710567896d7496cee4141"},"locator":{"namespace":"es-source-projections.v1","object_format":"sha1","relative_path":"git-sha1/8f191031f233d50a4d020d8a988036e99487f570","storage_root":"/home/ollie/.local/state/orchestrator/es-source-projections"},"policies":{"lfs":"reject-pointers-and-filter-attributes.v1","object_closure":"reachable-only.v1","symlinks":"lexically-contained-relative-utf8.v1"},"recipe":{"author":{"email":"e-series-source-projection@invalid","name":"E-series source projection","timestamp":1784674813,"timezone":"-0700"},"commit":"8f191031f233d50a4d020d8a988036e99487f570","commit_content_bytes":430,"commit_content_sha256":"sha256:c2989a3daeb32130711591a4941b0eaf3345e1a3f3816430dd8583d945411e31","message":"E-series F1 deterministic source projection\n\nSource-Commit: c081b7b6cd160b3da7031ee325bbf0ade1025d7a\nSource-Tree: 9193ae2f81116d1bac4cf3cb74395613c1220dbe\nProjection-Policy: e-series-source-projection.v1\n","message_bytes":204,"message_sha256":"sha256:b183cb771aca6398acdcb01f4983f110c92b43ad7cc148a01ca48f7719e464be","policy":"e-series-source-projection.v1"},"retained":{"inventory_serialization":"git-ls-tree-r-z.v1","inventory_sha256":"sha256:6fc936c54977d9adc7bdbae02bfa69592c55722e5cf5eddbd1b958ee1bc71404","leaf_count":1948,"mode_counts":{"executable":37,"regular":1874,"symlink":37},"tree":"e64f3c05f5a0894f41c047d128a9040a2cda6764"},"schema_version":"es_source_projection.v1","source":{"commit":"c081b7b6cd160b3da7031ee325bbf0ade1025d7a","repository":"/home/ollie/Documents/PtychoPINN","tree":"9193ae2f81116d1bac4cf3cb74395613c1220dbe"}}
